{
  "schema": "kmb.dataset/v1",
  "dataset_id": "kmb-dialogue-20261003-4",
  "seed": 20261003,
  "provenance": {
    "kind": "programmatic_synthetic",
    "human_gold": false,
    "oracle": "seeded fact values, keys, policies and revisions; unchanged assertions; dialogue retention intent",
    "source_dataset_id": "kmb-core-20261003-4",
    "input_style": "office_handover_dialogue",
    "subject_contrast": {
      "discrimination-0000": "distinct",
      "discrimination-0001": "distinct",
      "discrimination-0002": "similar",
      "discrimination-0003": "similar"
    }
  },
  "cases": [
    {
      "id": "persistence-0000",
      "dimension": "persistence",
      "stratum": "path",
      "synthetic": true,
      "facts": [
        {
          "subject": "季度财务归档",
          "key": "deployment_path",
          "value": "/srv/projects/12fdd593c59ac501",
          "policy": "retain",
          "revision": 1
        }
      ],
      "phases": [
        {
          "id": "learn",
          "kind": "write",
          "session": "learn",
          "message": "同事：这周由你接手下面这个办公项目，我先把正式设置交代清楚。\n「季度财务归档」的部署目录是「/srv/projects/12fdd593c59ac501」。\n这些是已确认的交接资料，请保存到长期记忆，以后新会话仍需调用。\n收到后只回复 JSON 对象 {\"ack\":true}，不用复述资料。"
        },
        {
          "id": "gap",
          "kind": "distract",
          "session": "gap",
          "message": "先暂停交接，帮我把“预订会议室、发出邀请、确认人数”整理成会务待办清单。这只是当前会话的小任务，不需要长期保存。"
        },
        {
          "id": "probe1",
          "kind": "query",
          "session": "probe1",
          "message": "今天换了一个新会话，我来继续办理交接。之前交接的「季度财务归档」，它的部署目录是什么？请依据此前保留的可靠资料回答。只回复含 answer 字段的 JSON 对象，字段值使用记忆中的原始字符串，不要改写。没有可靠记忆就将 answer 设为 null，不要猜测或重复问题。"
        },
        {
          "id": "probe2",
          "kind": "query",
          "session": "probe2",
          "message": "又隔了一次会话，现在重新核对一项交接设置。之前交接的「季度财务归档」，它的部署目录是什么？请依据此前保留的可靠资料回答。只回复含 answer 字段的 JSON 对象，字段值使用记忆中的原始字符串，不要改写。没有可靠记忆就将 answer 设为 null，不要猜测或重复问题。"
        }
      ],
      "assertions": [
        {
          "id": "fresh_session",
          "phase": "probe1",
          "type": "response_value",
          "field": "answer",
          "expected": "/srv/projects/12fdd593c59ac501",
          "alternatives": []
        },
        {
          "id": "second_fresh_session",
          "phase": "probe2",
          "type": "response_value",
          "field": "answer",
          "expected": "/srv/projects/12fdd593c59ac501",
          "alternatives": []
        }
      ]
    },
    {
      "id": "persistence-0001",
      "dimension": "persistence",
      "stratum": "symbolic_format",
      "synthetic": true,
      "facts": [
        {
          "subject": "会议纪要整理",
          "key": "export_format",
          "value": "FORMAT_24ea8fef05706cbb",
          "policy": "retain",
          "revision": 1
        }
      ],
      "phases": [
        {
          "id": "learn",
          "kind": "write",
          "session": "learn",
          "message": "同事：这周由你接手下面这个办公项目，我先把正式设置交代清楚。\n「会议纪要整理」的导出格式标识是「FORMAT_24ea8fef05706cbb」。\n这些是已确认的交接资料，请保存到长期记忆，以后新会话仍需调用。\n收到后只回复 JSON 对象 {\"ack\":true}，不用复述资料。"
        },
        {
          "id": "gap",
          "kind": "distract",
          "session": "gap",
          "message": "先处理一件小事：帮我拟一个询问同事下周哪天方便开会的简短标题。这只是当前会话的小任务，不需要长期保存。"
        },
        {
          "id": "probe1",
          "kind": "query",
          "session": "probe1",
          "message": "今天换了一个新会话，我来继续办理交接。之前交接的「会议纪要整理」，它的导出格式标识是什么？请依据此前保留的可靠资料回答。只回复含 answer 字段的 JSON 对象，字段值使用记忆中的原始字符串，不要改写。没有可靠记忆就将 answer 设为 null，不要猜测或重复问题。"
        },
        {
          "id": "probe2",
          "kind": "query",
          "session": "probe2",
          "message": "又隔了一次会话，现在重新核对一项交接设置。之前交接的「会议纪要整理」，它的导出格式标识是什么？请依据此前保留的可靠资料回答。只回复含 answer 字段的 JSON 对象，字段值使用记忆中的原始字符串，不要改写。没有可靠记忆就将 answer 设为 null，不要猜测或重复问题。"
        }
      ],
      "assertions": [
        {
          "id": "fresh_session",
          "phase": "probe1",
          "type": "response_value",
          "field": "answer",
          "expected": "FORMAT_24ea8fef05706cbb",
          "alternatives": []
        },
        {
          "id": "second_fresh_session",
          "phase": "probe2",
          "type": "response_value",
          "field": "answer",
          "expected": "FORMAT_24ea8fef05706cbb",
          "alternatives": []
        }
      ]
    },
    {
      "id": "persistence-0002",
      "dimension": "persistence",
      "stratum": "opaque_canary",
      "synthetic": true,
      "facts": [
        {
          "subject": "资产盘点",
          "key": "handover_code",
          "value": "HANDOVER_e6092cf70eb62485",
          "policy": "retain",
          "revision": 1
        }
      ],
      "phases": [
        {
          "id": "learn",
          "kind": "write",
          "session": "learn",
          "message": "同事：这周由你接手下面这个办公项目，我先把正式设置交代清楚。\n「资产盘点」的交接编号是「HANDOVER_e6092cf70eb62485」。\n这些是已确认的交接资料，请保存到长期记忆，以后新会话仍需调用。\n收到后只回复 JSON 对象 {\"ack\":true}，不用复述资料。"
        },
        {
          "id": "gap",
          "kind": "distract",
          "session": "gap",
          "message": "暂时换个话题，把“补充纸张、检查投影、摆放座签”整理成会议准备清单。这只是当前会话的小任务，不需要长期保存。"
        },
        {
          "id": "probe1",
          "kind": "query",
          "session": "probe1",
          "message": "今天换了一个新会话，我来继续办理交接。之前交接的「资产盘点」，它的交接编号是什么？请依据此前保留的可靠资料回答。只回复含 answer 字段的 JSON 对象，字段值使用记忆中的原始字符串，不要改写。没有可靠记忆就将 answer 设为 null，不要猜测或重复问题。"
        },
        {
          "id": "probe2",
          "kind": "query",
          "session": "probe2",
          "message": "又隔了一次会话，现在重新核对一项交接设置。之前交接的「资产盘点」，它的交接编号是什么？请依据此前保留的可靠资料回答。只回复含 answer 字段的 JSON 对象，字段值使用记忆中的原始字符串，不要改写。没有可靠记忆就将 answer 设为 null，不要猜测或重复问题。"
        }
      ],
      "assertions": [
        {
          "id": "fresh_session",
          "phase": "probe1",
          "type": "response_value",
          "field": "answer",
          "expected": "HANDOVER_e6092cf70eb62485",
          "alternatives": []
        },
        {
          "id": "second_fresh_session",
          "phase": "probe2",
          "type": "response_value",
          "field": "answer",
          "expected": "HANDOVER_e6092cf70eb62485",
          "alternatives": []
        }
      ]
    },
    {
      "id": "persistence-0003",
      "dimension": "persistence",
      "stratum": "path",
      "synthetic": true,
      "facts": [
        {
          "subject": "工单知识库",
          "key": "deployment_path",
          "value": "/srv/projects/c6f35e4950ba70b6",
          "policy": "retain",
          "revision": 1
        }
      ],
      "phases": [
        {
          "id": "learn",
          "kind": "write",
          "session": "learn",
          "message": "同事：这周由你接手下面这个办公项目，我先把正式设置交代清楚。\n同事在英文登记簿中写的是：\nFor 工单知识库, the deployment directory is /srv/projects/c6f35e4950ba70b6.\n这些是已确认的交接资料，请保存到长期记忆，以后新会话仍需调用。\n收到后只回复 JSON 对象 {\"ack\":true}，不用复述资料。"
        },
        {
          "id": "gap",
          "kind": "distract",
          "session": "gap",
          "message": "先帮我把“今天的讨论到这里，谢谢大家”改写成简短的散会用语。这只是当前会话的小任务，不需要长期保存。"
        },
        {
          "id": "probe1",
          "kind": "query",
          "session": "probe1",
          "message": "今天换了一个新会话，我来继续办理交接。之前交接的「工单知识库」，它的部署目录是什么？请依据此前保留的可靠资料回答。只回复含 answer 字段的 JSON 对象，字段值使用记忆中的原始字符串，不要改写。没有可靠记忆就将 answer 设为 null，不要猜测或重复问题。"
        },
        {
          "id": "probe2",
          "kind": "query",
          "session": "probe2",
          "message": "又隔了一次会话，现在重新核对一项交接设置。之前交接的「工单知识库」，它的部署目录是什么？请依据此前保留的可靠资料回答。只回复含 answer 字段的 JSON 对象，字段值使用记忆中的原始字符串，不要改写。没有可靠记忆就将 answer 设为 null，不要猜测或重复问题。"
        }
      ],
      "assertions": [
        {
          "id": "fresh_session",
          "phase": "probe1",
          "type": "response_value",
          "field": "answer",
          "expected": "/srv/projects/c6f35e4950ba70b6",
          "alternatives": []
        },
        {
          "id": "second_fresh_session",
          "phase": "probe2",
          "type": "response_value",
          "field": "answer",
          "expected": "/srv/projects/c6f35e4950ba70b6",
          "alternatives": []
        }
      ]
    },
    {
      "id": "retrieval-0000",
      "dimension": "retrieval",
      "stratum": "path",
      "synthetic": true,
      "facts": [
        {
          "subject": "预算初稿",
          "key": "deployment_path",
          "value": "DISTRACTOR_c970c27e6e51fcf4_0",
          "policy": "retain",
          "revision": 1
        },
        {
          "subject": "采购登记",
          "key": "deployment_path",
          "value": "DISTRACTOR_c970c27e6e51fcf4_1",
          "policy": "retain",
          "revision": 1
        },
        {
          "subject": "访客登记",
          "key": "deployment_path",
          "value": "DISTRACTOR_c970c27e6e51fcf4_2",
          "policy": "retain",
          "revision": 1
        },
        {
          "subject": "物品借用",
          "key": "deployment_path",
          "value": "DISTRACTOR_c970c27e6e51fcf4_3",
          "policy": "retain",
          "revision": 1
        },
        {
          "subject": "年度报表汇总",
          "key": "deployment_path",
          "value": "/srv/projects/104d6bf2fbefd68f",
          "policy": "retain",
          "revision": 1
        }
      ],
      "phases": [
        {
          "id": "learn",
          "kind": "write",
          "session": "learn",
          "message": "整理员：今天一起移交几个项目的登记信息，请按各自的项目名称分别记录。\n「预算初稿」的部署目录是「DISTRACTOR_c970c27e6e51fcf4_0」。\n「采购登记」的部署目录是「DISTRACTOR_c970c27e6e51fcf4_1」。\n「访客登记」的部署目录是「DISTRACTOR_c970c27e6e51fcf4_2」。\n「物品借用」的部署目录是「DISTRACTOR_c970c27e6e51fcf4_3」。\n「年度报表汇总」的部署目录是「/srv/projects/104d6bf2fbefd68f」。\n这些是已确认的交接资料，请保存到长期记忆，以后新会话仍需调用。\n收到后只回复 JSON 对象 {\"ack\":true}，不用复述资料。"
        },
        {
          "id": "gap",
          "kind": "distract",
          "session": "gap",
          "message": "先暂停交接，帮我把“预订会议室、发出邀请、确认人数”整理成会务待办清单。这只是当前会话的小任务，不需要长期保存。"
        },
        {
          "id": "probe",
          "kind": "query",
          "session": "probe",